<?xml version="1.0" encoding="UTF-8"?>
<resource xmlns:xsi="http://www.w3.org/2001/XMLSchema-instance" xmlns="http://datacite.org/schema/kernel-4" xsi:schemaLocation="http://datacite.org/schema/kernel-4 https://schema.datacite.org/meta/kernel-4/metadata.xsd">
    <identifier identifierType="DOI">10.82433/q80x-4z58</identifier>
    <creators>
        <creator>
            <creatorName nameType="Personal">Garcia, Sofia</creatorName>
            <givenName>Sofia</givenName>
            <familyName>Garcia</familyName>
            <nameIdentifier schemeURI="https://orcid.org/" nameIdentifierScheme="ORCID">https://orcid.org/0000-0001-5727-2427</nameIdentifier>
            <affiliation affiliationIdentifier="https://ror.org/03efmqc40" affiliationIdentifierScheme="ROR" schemeURI="https://ror.org/">Arizona State University</affiliation>
        </creator>
    </creators>
    <titles>
        <title xml:lang="en">Persistent Identifiers in Practice: Enhancing Poster Discoverability and Reuse</title>
    </titles>
    <publisher>International Metadata Forum</publisher>
    <publicationYear>2025</publicationYear>
    <dates>
        <date dateType="Issued">2025</date>
    </dates>
    <resourceType resourceTypeGeneral="Poster">Conference poster</resourceType>
    <relatedIdentifiers>
        <relatedIdentifier relatedIdentifierType="URL" relationType="Other" relationTypeInformation="was presented at" resourceTypeGeneral="Event">https://example.org/metadata-forum-2025</relatedIdentifier>
    </relatedIdentifiers>
    <language>en</language>
    <descriptions>
        <description xml:lang="en" descriptionType="Abstract">Posters are a key channel for sharing early research, yet they often disappear after the event. This poster shows how persistent identifiers (PIDs) can make posters easier to cite, discover, and reuse.</description>
    </descriptions>
</resource>