<?xml version="1.0" encoding="UTF-8"?>
<resource xmlns:xsi="http://www.w3.org/2001/XMLSchema-instance" xmlns="http://datacite.org/schema/kernel-4" xsi:schemaLocation="http://datacite.org/schema/kernel-4 http://schema.datacite.org/meta/kernel-4.3/metadata.xsd">
  <identifier identifierType="DOI">10.5072/10.CPoS-example</identifier>
  <creators>
    <creator>
      <creatorName nameType="Personal">Kreyenfeld, Michaela</creatorName>
      <givenName>Michaela</givenName>
      <familyName>Kreyenfeld</familyName>
      <nameIdentifier nameIdentifierScheme="ISNI" schemeURI="http://isni.org/isni/">0000000117540116</nameIdentifier>
    </creator>
    <creator>
      <creatorName nameType="Personal">Hornung, Anne</creatorName>
      <givenName>Anne</givenName>
      <familyName>Hornung</familyName>
      <nameIdentifier nameIdentifierScheme="VIAF" schemeURI="http://viaf.org/viaf/">304639093</nameIdentifier>
    </creator>
    <creator>
      <creatorName nameType="Personal">Kubisch, Karolin</creatorName>
      <givenName>Karolin</givenName>
      <familyName>Kubisch</familyName>
      <nameIdentifier nameIdentifierScheme="VIAF" schemeURI="http://viaf.org/viaf/">303937450</nameIdentifier>
    </creator>
  </creators>
  <titles>
    <title xml:lang="en">The German Generations and Gender Survey</title>
    <title xml:lang="en" titleType="Subtitle">Some Critical Reflections on the Validity of Fertility Histories</title>
  </titles>
  <publisher xml:lang="en">Federal Institute for Population Research, Germany</publisher>
  <publicationYear>2013</publicationYear>
  <subjects>
    <subject xml:lang="en">Fertility</subject>
    <subject xml:lang="en">Marriage</subject>
    <subject xml:lang="en">Germany</subject>
    <subject xml:lang="en">Data validation</subject>
    <subject xml:lang="en">Mikrozensus</subject>
    <subject xml:lang="en">Gender survey</subject>
    <subject xml:lang="en" schemeURI="http://www.gesis.org/en/services/research/tools-for-searching/classification" subjectScheme="GESIS">10300 Demography, Population Research</subject>
  </subjects>
  <contributors>
    <contributor contributorType="Editor">
      <contributorName xml:lang="en" nameType="Organizational">Federal Institute for Population Research</contributorName>
      <nameIdentifier nameIdentifierScheme="ISNI" schemeURI="http://isni.org/isni/">0000000094455866</nameIdentifier>
    </contributor>
  </contributors>
  <language>en</language>
  <resourceType resourceTypeGeneral="Text">Article</resourceType>
  <alternateIdentifiers>
    <alternateIdentifier alternateIdentifierType="internal ID">da|ra.14.103</alternateIdentifier>
  </alternateIdentifiers>
  <relatedIdentifiers>
    <relatedIdentifier relatedIdentifierType="URN" relationType="IsIdenticalTo">urn:nbn:de:bib-cpos-2013-02en8</relatedIdentifier>
    <relatedIdentifier relatedIdentifierType="DOI" relationType="IsIdenticalTo">10.4232/10.CPoS-2013-02en</relatedIdentifier>
  </relatedIdentifiers>
  <formats>
    <format>PDF</format>
  </formats>
  <version>1</version>
  <rightsList>
   <rights xml:lang="en-US" schemeURI="https://spdx.org/licenses/" rightsIdentifierScheme="SPDX" rightsIdentifier="CC-BY-NC-ND-3.0" rightsURI="http://creativecommons.org/licenses/by-nc-nd/3.0/deed">Creative Commons License: Attribution-NonCommercial-NoDerivs 3.0 Unported</rights>
  </rightsList>
  <descriptions>
    <description xml:lang="en" descriptionType="SeriesInformation">Comparative Population Studies Vol 38, No 1 (2013)</description>
    <description xml:lang="en" descriptionType="Abstract">This paper validates the fertility histories of the German Generations and Gender Survey (GGS). Focusing on the cohorts 1930-69 of West German women, the total number of children, the parity distribution and the parity progression ratios are comparedto external sources. One major result from this validation is that the German GGS understates the fertility for the older cohorts and overstates it for the younger ones.</description>
  </descriptions>
</resource>
