<?xml version="1.0" encoding="UTF-8"?>
<resource xmlns:xsi="http://www.w3.org/2001/XMLSchema-instance"
    xmlns="http://datacite.org/schema/kernel-4"
    xsi:schemaLocation="http://datacite.org/schema/kernel-4 https://schema.datacite.org/meta/kernel-4/metadata.xsd">
    <identifier identifierType="DOI">10.82433/0320-9g16</identifier>
    <creators>
        <creator>
            <creatorName nameType="Personal">Garcia, Sofia</creatorName>
            <givenName>Sofia</givenName>
            <familyName>Garcia</familyName>
            <nameIdentifier schemeURI="https://orcid.org/" nameIdentifierScheme="ORCID">
                https://orcid.org/0000-0001-5727-2427</nameIdentifier>
            <affiliation affiliationIdentifier="https://ror.org/03efmqc40"
                affiliationIdentifierScheme="ROR" schemeURI="https://ror.org">Arizona State
                University</affiliation>
        </creator>
    </creators>
    <titles>
        <title xml:lang="en">Comment on "Improving Metadata Quality in Scholarly Repositories"</title>
    </titles>
    <publisher>Global Open Research</publisher>
    <publicationYear>2025</publicationYear>
    <resourceType resourceTypeGeneral="Preprint" />
    <relatedIdentifiers>
        <relatedIdentifier relatedIdentifierType="DOI" relationType="Other"
            relationTypeInformation="is reply to" resourceTypeGeneral="JournalArticle">10.82433/e34e-y143</relatedIdentifier>
    </relatedIdentifiers>
    <language>en</language>
    <descriptions>
        <description xml:lang="en" descriptionType="Abstract">This preprint provides a response to
            the article "Improving Metadata Quality in Scholarly Repositories." It discusses
            additional considerations for enhancing metadata completeness, consistency, and
            interoperability. The authors highlight practical workflows, offer examples of common
            metadata challenges, and suggest strategies to improve discoverability and reuse of
            repository content.</description>
    </descriptions>
</resource>