<?xml version="1.0" encoding="UTF-8"?>
<resource xmlns:xsi="http://www.w3.org/2001/XMLSchema-instance" xmlns="http://datacite.org/schema/kernel-4" xsi:schemaLocation="http://datacite.org/schema/kernel-4 https://schema.datacite.org/meta/kernel-4/metadata.xsd">
    <identifier identifierType="DOI">10.82433/pma6-nf93</identifier>
    <creators>
        <creator>
            <creatorName nameType="Personal">Green, Simon</creatorName>
        </creator>
    </creators>
    <titles>
        <title xml:lang="de">Klimawandel und Anpassungsstrategien</title>
    </titles>
    <publisher>Institut für Umweltforschung</publisher>
    <publicationYear>2022</publicationYear>
    <dates>
        <date dateType="Issued">2022-07-07</date>
    </dates>
    <resourceType resourceTypeGeneral="Report"/>
    <language>de</language>
    <relatedIdentifiers>
        <relatedIdentifier relatedIdentifierType="DOI" relationType="HasTranslation">10.82433/45e5-xy14</relatedIdentifier>
    </relatedIdentifiers>
    <descriptions>
        <description xml:lang="de" descriptionType="Abstract">Dieser Bericht untersucht die Auswirkungen des Klimawandels und erkundet mögliche Anpassungsstrategien. Er befasst sich mit Themen wie extremen Wetterereignissen, Anpassungsmaßnahmen für städtische und ländliche Gebiete und politischen Empfehlungen zur Minderung von Klimarisiken.</description>
    </descriptions>
</resource>