<?xml version="1.0" encoding="UTF-8"?>
<resource xmlns:xsi="http://www.w3.org/2001/XMLSchema-instance" xmlns="http://datacite.org/schema/kernel-4" xsi:schemaLocation="http://datacite.org/schema/kernel-4 http://schema.datacite.org/meta/kernel-4.3/metadata.xsd">
  <identifier identifierType="DOI">10.5072/geoPointExample</identifier>
  <creators>
    <creator>
      <creatorName nameType="Personal">Schumann, Kai</creatorName>
    </creator>
    <creator>
      <creatorName nameType="Personal">Völker, David</creatorName>
    </creator>
    <creator>
      <creatorName nameType="Personal">Weinrebe, Wilhelm Reiber</creatorName>
    </creator>
  </creators>
  <titles>
    <title xml:lang="en">
      Gridded results of swath bathymetric mapping of Disko Bay, Western Greenland, 2007-2008
    </title>
  </titles>
  <publisher xml:lang="en">
    PANGAEA - Data Publisher for Earth &amp; Environmental Science
  </publisher>
  <publicationYear>2011</publicationYear>
  <subjects>
    <subject xml:lang="en" subjectScheme="DDC">551 Geology, hydrology, meteorology</subject>
  </subjects>
  <contributors>
    <contributor contributorType="HostingInstitution">
      <contributorName nameType="Organizational">
        IFM-GEOMAR Leibniz-Institute of Marine Sciences, Kiel University
      </contributorName>
      <nameIdentifier nameIdentifierScheme="ROR" schemeURI="http://ror.org/">https://ror.org/02h2x0161</nameIdentifier>
    </contributor>
  </contributors>
  <language>en</language>
  <resourceType resourceTypeGeneral="Dataset"/>
  <relatedIdentifiers>
    <relatedIdentifier relatedIdentifierType="DOI" relationType="Continues">10.5072/timeSeries</relatedIdentifier>
  </relatedIdentifiers>
  <sizes>
    <size>4 datasets</size>
  </sizes>
  <formats>
    <format>application/zip</format>
  </formats>
  <rightsList>
    <rights xml:lang="en-US" schemeURI="https://spdx.org/licenses/" rightsIdentifierScheme="SPDX" rightsIdentifier="
CC-BY-3.0"  rightsURI="http://creativecommons.org/licenses/by/3.0/deed">Creative Commons Attribution-NoDerivs 2.0 Generic</rights></rightsList>
  <descriptions>
    <description xml:lang="en" descriptionType="Abstract">
      A ship-based acoustic mapping campaign was conducted at the exit of Ilulissat Ice Fjord and in the sedimentary basin of Disko Bay to the west of the fjord mouth. Submarine landscape and sediment distribution patterns are interpreted in terms of
      glaciomarine facies types that are related to variations in the past position of the glacier front. In particular, asymmetric ridges that form a curved entity and a large sill at the fjord mouth may represent moraines hat depict at least two
      relatively stable positions of the ice front in the Disko Bay and at the fjord mouth. In this respect, Ilulissat Glacier shows prominent differences to the East Greenland Kangerlussuaq Glacier which is comparable in present size and present role for
      the ice discharge from the inland ice sheet. Two linear clusters of pockmarks in the center of the sedimentary basin seem to be linked to ongoing methane release due to dissociation of gas hydrates, a process fueled by climate warming in the Arctic
      realm.
    </description>
  </descriptions>
  <geoLocations>
    <geoLocation>
      <geoLocationPlace>Disko Bay</geoLocationPlace>
      <geoLocationPoint>
        <pointLongitude>-52.000000</pointLongitude>
        <pointLatitude>69.000000</pointLatitude>
      </geoLocationPoint>
    </geoLocation>
  </geoLocations>
</resource>
