<?xml version="1.0" encoding="UTF-8"?>
<resource xmlns="http://datacite.org/schema/kernel-2.2" xmlns:xsi="http://www.w3.org/2001/XMLSchema-instance" xsi:schemaLocation="http://datacite.org/schema/kernel-2.2 http://schema.datacite.org/meta/kernel-2.2/metadata.xsd">
	<identifier identifierType="DOI">10.5072/testpub</identifier>
	<creators>
		<creator>
			<creatorName>Smith, John</creatorName>
		</creator>
		<creator>
			<creatorName>つまらないものですが</creatorName>
			<nameIdentifier nameIdentifierScheme="ISNI">abc123</nameIdentifier>
		</creator>
	</creators>
	<titles>
		<title>Właściwości rzutowań podprzestrzeniowych</title>
		<title titleType="TranslatedTitle">Translation of Polish titles</title>
	</titles>
	<publisher>Springer</publisher>
	<publicationYear>2010</publicationYear>
	<subjects>
		<subject subjectScheme="DDC">830 German &amp; related literatures</subject>
		<subject>Polish Literature</subject>
	</subjects>
	<contributors>
		<contributor contributorType="DataCollector">
			<contributorName>Doe, John</contributorName>
			<nameIdentifier nameIdentifierScheme="ORCID">456xyz</nameIdentifier>
		</contributor>
	</contributors>
	<dates>
		<date dateType="StartDate">2009-04-29</date>
		<date dateType="EndDate">2010-01-05</date>
	</dates>
	<language>GER</language>
	<resourceType resourceTypeGeneral="Text">Monograph</resourceType>
	<alternateIdentifiers>
		<alternateIdentifier alternateIdentifierType="ISBN">937-0-4523-12357-6</alternateIdentifier>
	</alternateIdentifiers>
	<relatedIdentifiers>
		<relatedIdentifier relatedIdentifierType="DOI" relationType="IsPartOf">10.5272/oldertestpub</relatedIdentifier>
	</relatedIdentifiers>
	<sizes>
		<size>256 pages</size>
	</sizes>
	<formats>
		<format>pdf</format>
	</formats>
	<version>2</version>
	<rights>CC by-nd</rights>
	<descriptions>
		<description descriptionType="Abstract">Lorem ipsum dolor sit amet, consetetur sadipscing elitr, sed diam nonumy eirmod tempor invidunt ut labore et dolore magna aliquyam erat, sed diam voluptua. At vero eos et accusam et justo duo dolores et ea rebum. Stet clita kasd gubergren, no sea takimata sanctus est Lorem ipsum dolor sit amet. Lorem ipsum dolor sit amet, consetetur sadipscing elitr, sed diam nonumy eirmod tempor invidunt ut labore et dolore magna aliquyam erat, sed diam voluptua. At vero eos et accusam et justo duo dolores et ea rebum. Stet clita kasd gubergren, no sea takimata sanctus est Lorem ipsum dolor sit amet.</description>
	</descriptions>
</resource>
